question,choices,answerKey
Which factor will most likely cause a person to develop a fever?,"{'text': ['a leg muscle relaxing after exercise', 'a bacterial population in the bloodstream', 'several viral particles on the skin', 'carbohydrates being digested in the stomach'], 'label': ['A', 'B', 'C', 'D']}",B
Lichens are symbiotic organisms made of green algae and fungi. What do the green algae supply to the fungi in this symbiotic relationship?,"{'text': ['carbon dioxide', 'food', 'protection', 'water'], 'label': ['A', 'B', 'C', 'D']}",B
"When a switch is used in an electrical circuit, the switch can","{'text': ['cause the charge to build.', 'increase and decrease the voltage.', 'cause the current to change direction.', 'stop and start the flow of current.'], 'label': ['A', 'B', 'C', 'D']}",D
Which of the following is an example of an assistive device?,"{'text': ['contact lens', 'motorcycle', 'raincoat', 'coffee pot'], 'label': ['A', 'B', 'C', 'D']}",A
"Rocks are classified as igneous, metamorphic, or sedimentary according to","{'text': ['their color', 'their shape', 'how they formed', 'the minerals they contain'], 'label': ['1', '2', '3', '4']}",3
A chewable calcium carbonate tablet is a common treatment for stomach discomfort. Calcium carbonate is most likely used as this type of medicine because calcium carbonate,"{'text': ['has a pleasant flavor.', 'is inexpensive to produce.', 'neutralizes digestive acid.', 'occurs naturally in the body.'], 'label': ['A', 'B', 'C', 'D']}",C
Which two body systems are directly involved in movement?,"{'text': ['muscular and skeletal', 'digestive and muscular', 'skeletal and respiratory', 'respiratory and digestive'], 'label': ['A', 'B', 'C', 'D']}",A
Which change in the state of water particles causes the particles to become arranged in a fixed position?,"{'text': ['boiling', 'melting', 'freezing', 'evaporating'], 'label': ['A', 'B', 'C', 'D']}",C
Earth's core is primarily composed of which of the following materials?,"{'text': ['basalt', 'iron', 'magma', 'quartz'], 'label': ['A', 'B', 'C', 'D']}",B
Which of the following events during meiosis contributes most to the variation within a species?,"{'text': ['pairing of chromosomes', 'creation of haploid gametes', 'segregation of alleles', 'separation of chromatids'], 'label': ['A', 'B', 'C', 'D']}",C
"Which of the following was probably most important in the formation of dark, fertile soil that is good for farming?","{'text': ['plant decomposition', 'radioactive decay', 'water erosion', 'wind erosion'], 'label': ['A', 'B', 'C', 'D']}",A
"When igneous rock is changed into metamorphic rock, which form of energy is this process?","{'text': ['heat', 'chemical', 'magnetic', 'light'], 'label': ['A', 'B', 'C', 'D']}",A
"In humans, the digestion process begins in","{'text': ['the intestine, with squeezing.', 'the mouth, with chewing and saliva.', 'the stomach, with churning and acid.', 'the esophagus, with pushing towards the stomach.'], 'label': ['A', 'B', 'C', 'D']}",B
Which of these items contains only a solution?,"{'text': ['a jar of pickles', 'a bottle of juice', 'a bag of peanuts', 'a can of mixed fruit'], 'label': ['A', 'B', 'C', 'D']}",B
"Many natural rock formations change color over time. In Utah, for example, iron oxidized and formed red, orange, and yellow rock. Which of the following is the cause of this change?","{'text': ['chemical weathering', 'mechanical weathering', 'water erosion', 'wind erosion'], 'label': ['A', 'B', 'C', 'D']}",A
"A population of small, plant-eating beetles lives in a forest. About half of the beetles are light brown and the others are dark green. If years of drought cause the area to become dry with few trees, what would the beetle population most likely look like after several generations?","{'text': ['It would be mostly light brown beetles.', 'It would be mostly dark green beetles.', 'It would be mostly carnivorous beetles.', 'It would be mostly very large beetles.'], 'label': ['A', 'B', 'C', 'D']}",A
A scientist wanting to document a change in a river's flow pattern should observe a river over a period of,"{'text': ['days.', 'weeks.', 'months.', 'years.'], 'label': ['A', 'B', 'C', 'D']}",D
Automobile engines built today are designed to be gas efficient. Gas-efficient engines most likely affect a city by reducing,"{'text': ['air pollution.', 'heat pollution.', 'noise pollution.', 'light pollution.'], 'label': ['A', 'B', 'C', 'D']}",A
"A student in an empty classroom shouts, ""Hello!"" Which best explains what the student hears after the shout?","{'text': ['an increased loudness of sound', 'a reflection of sound', 'an increased frequency of sound', 'a refraction of sound'], 'label': ['A', 'B', 'C', 'D']}",B
Which type of energy in gasoline is transformed into mechanical energy in a motorcycle engine?,"{'text': ['chemical', 'nuclear', 'magnetic', 'electrical'], 'label': ['1', '2', '3', '4']}",1
A student standing near a campfire feels warmer as the fire grows. Which process most likely transfers heat from the campfire to the student?,"{'text': ['conduction', 'convection', 'radiation', 'transformation'], 'label': ['A', 'B', 'C', 'D']}",C
"In snapdragon plants, red flowers are dominant to white flowers. When red-flowered plants are crossed with white-flowered plants, pink flowers are produced. If a researcher wants to produce plants with only white flowers, what color should the parent plants be?","{'text': ['both red', 'both white', 'one red and one white', 'one white and one pink'], 'label': ['A', 'B', 'C', 'D']}",B
"Scientists use the term ""light year"" to describe","{'text': ['how fast light travels in space.', 'the distance light travels in one year.', 'how large the diameters of different stars are.', 'the time it takes the Sun to move through the galaxy.'], 'label': ['A', 'B', 'C', 'D']}",B
Plate movement can form different features on Earth. The movement of tectonic plates can be both a constructive and a destructive force. At which type of plate boundary is new crust formed?,"{'text': ['convergent', 'subduction', 'transform', 'divergent'], 'label': ['A', 'B', 'C', 'D']}",D
Which group of organisms can show significant trait changes in the shortest period of time?,"{'text': ['bacteria', 'birds', 'fish', 'reptiles'], 'label': ['1', '2', '3', '4']}",1
Peach trees have sweet-smelling blossoms and produce rich fruit. What is the main purpose of the flowers of a peach tree?,"{'text': ['to attract bees for pollination', 'to create flower arrangements', 'to protect the tree from disease', 'to feed migratory birds'], 'label': ['A', 'B', 'C', 'D']}",A
A group of students are researching changes in climate in their region. Which of these would best provide evidence of changes in temperature and rainfall over a period of years?,"{'text': ['tree rings', 'pollen samples', 'harvest production', 'carbon dating'], 'label': ['A', 'B', 'C', 'D']}",A
Which of these would help to prevent infections from occurring in small cuts and scrapes?,"{'text': ['apply a cold ice pack', 'raise the injured area', 'apply pressure to stop bleeding', 'wash the area with warm, soapy water'], 'label': ['A', 'B', 'C', 'D']}",D
Which best describes why winds at the beach change direction between day and night?,"{'text': ['because the temperatures over land and over water change', 'because warm air over land sinks and stays in place over land', 'because cool air rises and is replaced by warm air from the ocean', 'because cool air sinks and stays in place over land'], 'label': ['A', 'B', 'C', 'D']}",A
Soil erosion can be best prevented by,"{'text': ['removing grass from the steepest slope.', 'building terraces into the sides of a slope.', 'heavily watering the vegetation on the slope.', 'increasing the slope of the land by adding more soil.'], 'label': ['A', 'B', 'C', 'D']}",B
Which of the following properties provides the BEST way to identify a mineral?,"{'text': ['hardness', 'shape', 'size', 'temperature'], 'label': ['A', 'B', 'C', 'D']}",A
Which sequence represents the order of development for many plants?,"{'text': ['seed develops inside fruit -> seed is dispersed -> seed germinates -> plant grows', 'seed is dispersed -> seed develops inside fruit -> seed germinates -> plant grows', 'seed germinates -> plant grows -> seed is dispersed -> seed develops inside fruit', 'seed is dispersed -> plant grows -> seed germinates -> seed develops inside fruit'], 'label': ['1', '2', '3', '4']}",1
"When ice cream is left out of a freezer, the ice cream changes from a ___.","{'text': ['solid to a gas', 'gas to a liquid', 'solid to a liquid', 'liquid to a gas'], 'label': ['A', 'B', 'C', 'D']}",C
Which equipment will best separate a mixture of iron filings and black pepper?,"{'text': ['magnet', 'filter paper', 'triple-beam balance', 'voltmeter'], 'label': ['1', '2', '3', '4']}",1
Which characteristic is shared by all cells?,"{'text': ['They need energy.', 'They reproduce sexually.', 'They make their own food.', 'They move from place to place.'], 'label': ['A', 'B', 'C', 'D']}",A
"On a small, isolated island, a hurricane destroyed all the trees that produced a large, hard-shelled nut. Which bird population would most likely decrease?","{'text': ['birds with long, probing beaks', 'birds with thick, strong beaks', 'birds with thin, short beaks', 'birds with large, pouch beaks'], 'label': ['A', 'B', 'C', 'D']}",B
"A cow and a frog have similar bone structures in their forelimbs. Both have phalanges, radius, ulna, and humerus bones. However, the cow and frog are animals with very different life cycles from each other. Which most likely describes why the body structures of these animals are so similar?","{'text': ['Both have undergone similar mutations.', 'Both descended from a common ancestor.', 'Both reacted similarly to environmental pressures.', 'Both spread out from the same geographical region.'], 'label': ['A', 'B', 'C', 'D']}",B
A cell that is unable to import substances required to process chemical energy is most likely a result of a malfunctioning,"{'text': ['cell membrane.', 'endoplasmic reticulum.', 'Golgi body.', 'nuclear envelope.'], 'label': ['A', 'B', 'C', 'D']}",A
Which best describes all unicellular organisms?,"{'text': ['Every cell is round.', 'Every cell can make food.', 'Every cell can move on its own.', 'Every cell performs all life functions.'], 'label': ['A', 'B', 'C', 'D']}",D
"When a transverse wave passes from right to left through a medium, what happens to the particles of the medium?","{'text': ['Particles travel from right to left along the wave.', 'Particles travel from left to right along the wave.', 'Particles move back and forth parallel to the wave.', 'Particles move back and forth perpendicular to the wave.'], 'label': ['A', 'B', 'C', 'D']}",D
Which characteristic below most likely accounts for our limited knowledge of galaxies?,"{'text': ['their tiny size', 'their magnetic cores', 'their inability to produce light', 'their great distance from Earth'], 'label': ['A', 'B', 'C', 'D']}",D
Decomposers increase the fertility of the soil and prevent dead organisms from building up in the environment. In which way do decomposers make the soil more fertile?,"{'text': ['by adding carbon', 'by adding nitrogen', 'by removing excess water', 'by removing excess minerals'], 'label': ['A', 'B', 'C', 'D']}",B
"When oxygen combines with hydrogen, which substance is formed?","{'text': ['water', 'vinegar', 'hydrochloric acid', 'hydrogen dioxide'], 'label': ['A', 'B', 'C', 'D']}",A
"When plants undergo photosynthesis, a reaction produces sugar, oxygen, and water. During respiration, stored energy from the products of photosynthesis is converted to usable energy. In what form is the energy stored prior to use in respiration?","{'text': ['chemical energy', 'kinetic energy', 'light energy', 'heat energy'], 'label': ['A', 'B', 'C', 'D']}",A
Which of the following is a typical example of a unicellular organism?,"{'text': ['earthworm', 'bacteria', 'fungi', 'green algae'], 'label': ['A', 'B', 'C', 'D']}",B
"Over geologic time, global mean sea level has varied significantly. Which change is most likely responsible for an increase in global mean sea level?","{'text': ['erosion of sediment from a mountain range', 'mass extinction of marine organisms', 'formation of an ocean trench', 'melting of polar ice caps'], 'label': ['A', 'B', 'C', 'D']}",D
Which body system is most responsible for the removal of waste?,"{'text': ['skeletal system', 'nervous system', 'muscular system', 'excretory system'], 'label': ['A', 'B', 'C', 'D']}",D
In which environment is white fur color an advantage for survival?,"{'text': ['desert', 'grassland', 'arctic tundra', 'temperate forest'], 'label': ['A', 'B', 'C', 'D']}",C
Which of these will best separate iron filings from sand?,"{'text': ['water', 'a magnifying glass', 'a magnet', 'rubbing alcohol'], 'label': ['A', 'B', 'C', 'D']}",C
Which of these is the chemical symbol for magnesium?,"{'text': ['Ma', 'Mg', 'Mn', 'Mu'], 'label': ['A', 'B', 'C', 'D']}",B
Which of the following is most likely to lead to error in an experiment?,"{'text': ['bias', 'repeated trials', 'peer review', 'use of a control'], 'label': ['A', 'B', 'C', 'D']}",A
Which best describes transportation technology?,"{'text': ['a system that is used to move people and products', 'an enterprise that changes raw materials into goods', 'the building and finishing of structures', 'the conversion of mechanical energy into heat energy'], 'label': ['A', 'B', 'C', 'D']}",A
"In a gasoline-powered car, chemical energy from gasoline is transformed to make the car move. The motion of the car is what form of energy?","{'text': ['radiant energy', 'nuclear energy', 'electrical energy', 'mechanical energy'], 'label': ['A', 'B', 'C', 'D']}",D
Which characteristic is affected by interactions with the environment?,"{'text': ['weight', 'eye color', 'blood type', 'handedness'], 'label': ['A', 'B', 'C', 'D']}",A
Which is the greatest impact humans have had on the carbon cycle?,"{'text': ['clear-cutting forests', 'manufacturing plastics', 'burning fossil fuels', 'growing agricultural crops'], 'label': ['A', 'B', 'C', 'D']}",C
The floating arrow on a compass always points towards the,"{'text': ['west.', 'east.', 'south.', 'north.'], 'label': ['A', 'B', 'C', 'D']}",D
"Which color shirt will reflect the most light on a hot, sunny day?","{'text': ['black', 'blue', 'red', 'white'], 'label': ['A', 'B', 'C', 'D']}",D
"A 10 g sample of aluminum and a 10 g sample of iron were each heated by 100 joules of energy. The temperature of the aluminum sample rose 11°C, while the temperature of the iron sample increased 23°C. Which statement best accounts for these results?","{'text': ['Iron is twice as dense as aluminum.', 'Atoms of aluminum are smaller than atoms of iron.', 'Using equal masses results in similar heat capacities.', 'The specific heat of iron is less than that of aluminum.'], 'label': ['A', 'B', 'C', 'D']}",D
"If its food supply in a field decreases, the mouse population in that field will probably","{'text': ['increase.', 'decrease.', 'remain the same.', 'become extinct.'], 'label': ['A', 'B', 'C', 'D']}",B
Overuse of soil for farming causes local disruptions of several Earth subsystems. Which of these is a part of the biogeochemical cycle that experiences the most severe local disruption?,"{'text': ['release of carbon into the atmosphere', 'release of oxygen into the atmosphere', 'cycling phosphorus into the soil', 'cycling hydrogen into the soil'], 'label': ['A', 'B', 'C', 'D']}",C
Which of the following is an example of a physical change but not a chemical change?,"{'text': ['A log gives off heat and light as it burns.', 'A tree stores energy from the Sun in its fruit.', 'A penny lost in the grass slowly changes color.', 'A water pipe freezes and cracks on a cold night.'], 'label': ['A', 'B', 'C', 'D']}",D
"While conducting an investigation on refraction, a teacher uses a red laser pointer to show how a beam of light is affected as it passes through several glass objects. The teacher should make sure that the","{'text': ['room is totally dark.', 'light source is ultraviolet.', 'beam of light does not travel toward the students.', 'room walls are shielded with insulating material.'], 'label': ['A', 'B', 'C', 'D']}",C
One student wrote a report about an investigation in which fertilizer was added to tomato plants. Which information from that student's report would most help a second student repeat the investigation?,"{'text': ['the amount of fertilizer added', 'the height of the fertilized plants', 'the size of each tomato produced', 'the number of tomatoes produced'], 'label': ['A', 'B', 'C', 'D']}",A
A student wants to look under a heavy rock. Which simple machine would be BEST to use to lift the rock?,"{'text': ['Wheel and axle', 'Lever', 'Inclined plane', 'Screw'], 'label': ['A', 'B', 'C', 'D']}",B
Rust is a compound with the formula Fe_{2}O_{3}. Which elements combine to form rust?,"{'text': ['iron and water', 'iron and oxygen', 'iron and air', 'iron and acid'], 'label': ['A', 'B', 'C', 'D']}",B
The chemical equation below shows a reaction of copper (Cu) with silver nitrate (AgNO_{3}) yielding silver (Ag) and copper(II) nitrate (Cu(NO_{3})_{2}) Cu + 2AgNO_{3} -> 2Ag + Cu(NO_{3})_{2} Silver and copper(II) nitrate are called the,"{'text': ['reactants.', 'products.', 'catalysts.', 'inhibitors.'], 'label': ['A', 'B', 'C', 'D']}",B
What role does the centromere play in cellular reproduction?,"{'text': ['It is the area where microtubules are formed.', 'It is the area where the nucleus is during cell division.', 'It is the area of alignment for the chromosomes.', 'It is the area of attachment for chromatids.'], 'label': ['A', 'B', 'C', 'D']}",D
"If 1 kg of the compound toluene melts at -95°C, then 500 g of toluene will","{'text': ['melt at -47.5°C.', 'melt at -95°C.', 'boil at 95°C.', 'boil at 47.5°C.'], 'label': ['A', 'B', 'C', 'D']}",B
"A calculation based on the chemical energy of gasoline shows that a car should be able to go 100 miles on a gallon of fuel. When the car was driven on a test track, the car only went 25 miles on a gallon of fuel. What accounts for most of the difference?","{'text': ['the mass of the driver and the fuel carried by the car', 'the wind resistance between the car and the air nearby', 'the waste heat from the combustion of fuel in the engine', 'the friction between the tires and the surface of the track'], 'label': ['A', 'B', 'C', 'D']}",C
A student wants to find the relationship between the diameter of several plastic disks and the circumference of each disk. Which of these types of graphs should be constructed to determine this relationship?,"{'text': ['pie graph', 'line graph', 'scatterplot', 'box-and-whisker plot'], 'label': ['A', 'B', 'C', 'D']}",B
"When light is bounced off a mirror, the light is","{'text': ['reflected.', 'refracted.', 'absorbed.', 'diffracted.'], 'label': ['A', 'B', 'C', 'D']}",A
Which of the following sentences best explains what happens when puddles evaporate?,"{'text': ['The water absorbs into the ground.', 'The particles of matter move more slowly.', 'The water changes from one form to another.', 'The particles of matter move closer together.'], 'label': ['A', 'B', 'C', 'D']}",C
Plants on hills keep dirt in place during a rain storm. Plant roots grow into the dirt and keep the dirt from moving. Why do roots grow into the dirt?,"{'text': ['to release gases', 'to release water', 'to absorb energy', 'to absorb nutrients'], 'label': ['A', 'B', 'C', 'D']}",D
"In animal skin tissue, cell division is responsible for","{'text': ['growth and repair', 'sexual reproduction', 'obtaining energy', 'production of sex cells'], 'label': ['1', '2', '3', '4']}",1
Which process drives most of the ATP synthesis in a chloroplast?,"{'text': ['flow of protons across an electrochemical gradient', 'flow of tRNA across an electrochemical gradient', 'exposure of ADP to electromagnetic waves', 'exposure of carbohydrates to electromagnetic waves'], 'label': ['A', 'B', 'C', 'D']}",A
Which of the following is most consistent with the modern theory of evolution?,"{'text': ['Parents pass their physical traits to their offspring; those offspring with traits that help them survive in the environment are able to reproduce.', 'Parents change their physical traits in order to survive in the environment, then those parental traits are passed to their offspring.', 'Life on this planet came from another planet far out in space.', 'Living organisms have not changed for hundreds of millions of years.'], 'label': ['A', 'B', 'C', 'D']}",A
Felicia investigated whether water color affected how fast the water heated in sunlight. She poured tap water into five beakers and placed food coloring in four out of the five beakers. Felicia then used a thermometer to measure the temperature of the water in each of the beakers. Which of these was used as control in her investigation?,"{'text': ['mixing the food coloring in water', 'testing the beaker of uncolored tap water', 'using the same amount of water in each trial', 'testing the colored water samples at different times'], 'label': ['A', 'B', 'C', 'D']}",B
One process in the formation of sedimentary rocks is when rocks are,"{'text': ['compressed by moving plates.', 'heated and subjected to high pressure.', 'broken up and deposited in layers.', 'moved up along fault planes.'], 'label': ['A', 'B', 'C', 'D']}",C
Western coral snakes have a striped color pattern and are poisonous. Arizona mountain king snakes look like western coral snakes but are not poisonous. The color pattern of the Arizona mountain king snake is an example of,"{'text': ['camouflage.', 'mimicry.', 'mutualism.', 'parasitism.'], 'label': ['A', 'B', 'C', 'D']}",B
Which plant trait is inherited?,"{'text': ['the shape of its leaves', 'the amount of water it receives', 'the number of minerals it absorbs from soil', 'the level of sunlight to which it is exposed'], 'label': ['A', 'B', 'C', 'D']}",A
"A student put 200 milliliters (mL) of water into a pot, sets the pot on a burner, and heats the water to boil. When the pot is taken off the burner, it contains only 180 milliliters (mL) of water. What happened to the rest of the water?","{'text': ['It was used up.', 'It condensed.', 'It was absorbed by the heat.', 'It turned into water vapor.'], 'label': ['A', 'B', 'C', 'D']}",D
Howie put his plants under a plant light. What was he helping his plants do by providing light?,"{'text': ['make food', 'attract insects', 'release pollen', 'grow roots'], 'label': ['A', 'B', 'C', 'D']}",A
Which lists the diameter of the planets in order from smallest to largest?,"{'text': ['Venus, Earth, Mercury, Mars', 'Earth, Mars, Venus, Mercury', 'Mars, Mercury, Earth, Venus', 'Mercury, Mars, Venus, Earth'], 'label': ['A', 'B', 'C', 'D']}",D
The aloe plant can absorb a lot of water during a rain shower. The extra water is stored in its leaves. The ability to store water in its leaves is most likely an adaptation to which type of environment?,"{'text': ['one near the ocean', 'one with dry conditions', 'one with a variety of organisms', 'one that receives a lot of sunlight'], 'label': ['A', 'B', 'C', 'D']}",B
"When stratospheric ozone levels are reduced, the amount of ultraviolet radiation hitting Earth increases. Ozone depletion is most often caused","{'text': ['by the reversal of the magnetic field of Earth.', 'when fluorocarbons are released into the atmosphere.', 'when electromagnetic waves from the Sun increase.', 'by abrupt changes in weather and climate patterns.'], 'label': ['A', 'B', 'C', 'D']}",B
Owen tested a physical property of a mineral. He rubbed a mineral sample on a piece of white tile. The mineral left a red mark on the tile. Which of the following physical properties of the mineral was Owen most likely testing?,"{'text': ['cleavage', 'hardness', 'luster', 'streak'], 'label': ['A', 'B', 'C', 'D']}",D
Which of these animals has a young form that looks the most like the adult form?,"{'text': ['moth', 'human', 'frog', 'butterfly'], 'label': ['A', 'B', 'C', 'D']}",B
Two tectonic plates pushing toward each other cause intense heat and pressure in Earth's crust. Into which will crust material be changed by heat and pressure?,"{'text': ['fossils', 'sediments', 'igneous rock', 'metamorphic rock'], 'label': ['A', 'B', 'C', 'D']}",D
A student states that plants grow taller when grown in natural light than they do in artificial light. Which method is the best way to determine if the statement is fact or opinion?,"{'text': ['conduct a controlled experiment', 'discuss the statement with other students', 'ask several teachers their thoughts', 'propose a scientific conclusion'], 'label': ['A', 'B', 'C', 'D']}",A
Which object is powered by an electrical circuit?,"{'text': ['a drum', 'a flashlight', 'a matchstick', 'a wind-up toy'], 'label': ['A', 'B', 'C', 'D']}",B
"Which concept supports the endosymbiotic origin of complex, eukaryotic double-membrane structures?","{'text': ['Mitochondria and chloroplasts arise from preexisting mitochondria and chloroplasts.', 'Mitochondria and chloroplasts arise from preexisting endomembrane systems.', 'Mitochondria and chloroplasts are synthesized in the nucleus.', 'Mitochondria and chloroplasts are synthesized in ribosomes.'], 'label': ['A', 'B', 'C', 'D']}",A
Which of these human activities most relies on high-quality soil?,"{'text': ['Hiking', 'Hunting', 'Coal mining', 'Growing crops'], 'label': ['A', 'B', 'C', 'D']}",D
What is an example of a shelter in an ecosystem?,"{'text': ['a gray squirrel eating an acorn', 'a raccoon in a hollow log', 'a blue whale migrating', 'a tick feeding on a coyote'], 'label': ['A', 'B', 'C', 'D']}",B
